{"arms":[{"holders":[1,2,3],"profile_id":"LOCUS-paired-suite-deployment-2of3-v1","suite_id":"LOCUS-APPSS-2HASHDH-RISTRETTO255-SHA512-GF128-v1"},{"holders":[1,2,3],"profile_id":"LOCUS-paired-suite-deployment-2of3-v1","suite_id":"LOCUS-TPASS-YI-ZK-RISTRETTO255-v1"},{"holders":[1,2,3,4,5],"profile_id":"LOCUS-paired-suite-deployment-3of5-v1","suite_id":"LOCUS-APPSS-2HASHDH-RISTRETTO255-SHA512-GF128-v1"},{"holders":[1,2,3,4,5],"profile_id":"LOCUS-paired-suite-deployment-3of5-v1","suite_id":"LOCUS-TPASS-YI-ZK-RISTRETTO255-v1"}],"authorization":{"authorizers":[1,2,3,4,5],"quorum":4},"clients":{"enrollment":"ui-client-a","recovery":"ui-client-b"},"deployment_id":"LOCUS-integrated-reference-deployment-v1","networks":["admission","browser-edge","cloud","control","recovery","resolver","storage"],"policies":["LOCUS-canonical-email-set-v1","LOCUS-canonical-phone-set-v1","LOCUS-location-person-set-v1","LOCUS-quantized-coordinate-set-v1"],"provider":{"adapter":"s3-compatible-local","backup_object_format":"LOCUS-cloud-backup-object-v2","endpoint":"http://s3:8333","gateway_profile":"LOCUS-application-storage-gateway-v2","list_allowed":false,"tls_mode":"internal-emulation-only"},"services":[{"endpoint":"https://admission:8443","identity":"spiffe://locus.invalid/integrated/admission","name":"admission","networks":["admission"],"persistent_role":true},{"endpoint":null,"identity":"spiffe://locus.invalid/integrated/bootstrap","name":"bootstrap","networks":[],"persistent_role":false},{"endpoint":"https://operator:8443","identity":"spiffe://locus.invalid/integrated/operator","name":"operator","networks":["control"],"persistent_role":true},{"endpoint":"https://party1:8443","identity":"spiffe://locus.invalid/integrated/party1","name":"party1","networks":["recovery"],"persistent_role":true},{"endpoint":"https://party2:8443","identity":"spiffe://locus.invalid/integrated/party2","name":"party2","networks":["recovery"],"persistent_role":true},{"endpoint":"https://party3:8443","identity":"spiffe://locus.invalid/integrated/party3","name":"party3","networks":["recovery"],"persistent_role":true},{"endpoint":"https://party4:8443","identity":"spiffe://locus.invalid/integrated/party4","name":"party4","networks":["recovery"],"persistent_role":true},{"endpoint":"https://party5:8443","identity":"spiffe://locus.invalid/integrated/party5","name":"party5","networks":["recovery"],"persistent_role":true},{"endpoint":"https://resolver:8443","identity":"spiffe://locus.invalid/integrated/resolver","name":"resolver","networks":["resolver"],"persistent_role":false},{"endpoint":"http://s3:8333","identity":"spiffe://locus.invalid/integrated/s3","name":"s3","networks":["cloud"],"persistent_role":true},{"endpoint":"https://storage-gateway:8443","identity":"spiffe://locus.invalid/integrated/storage-gateway","name":"storage-gateway","networks":["cloud","storage"],"persistent_role":true},{"endpoint":"http://127.0.0.1:8765","identity":"spiffe://locus.invalid/integrated/ui-client-a","name":"ui-client-a","networks":["admission","browser-edge","control","recovery","resolver","storage"],"persistent_role":false},{"endpoint":"http://127.0.0.1:8765","identity":"spiffe://locus.invalid/integrated/ui-client-b","name":"ui-client-b","networks":["admission","browser-edge","control","recovery","resolver","storage"],"persistent_role":false}],"version":"LOCUS-integrated-reference-config-v1"}
